{
  "cost": {
    "agents": 4,
    "completion_tokens": 0,
    "prompt_tokens": 0,
    "usd": 0.0,
    "wall_s": 0.0
  },
  "deterministic": false,
  "inputs_sha": {
    "canon": "976f3901e36cd76b5626773192c933c1899e4a7e055e625ad866f81e3f6942af",
    "coarses": "e74114859d963f3639b5ed861e45ac367e3bbe846c903a9408291fd853fcdf73",
    "drafts": "37048dc7a5754049ecd19144fc6fac000e54b7df26d1274fe75e5284690f5bf9",
    "kb": "a1cd8d1dad897f93af246a26fa1d1268fc71699a251a68a28b1d26b48ad9701c"
  },
  "payload": {
    "proposals": [
      {
        "angle": "user_question_path",
        "coarses": [
          {
            "id": "A",
            "title": "帳號與身分"
          },
          {
            "id": "B",
            "title": "團隊、人員與大房東"
          },
          {
            "id": "C",
            "title": "社區與物件"
          },
          {
            "id": "D",
            "title": "租約（含委託約子題）"
          },
          {
            "id": "E",
            "title": "帳務（含發票、收款金流、抄表）"
          },
          {
            "id": "F",
            "title": "修繕"
          },
          {
            "id": "G",
            "title": "裝置（IoT）"
          },
          {
            "id": "H",
            "title": "幫助中心"
          },
          {
            "id": "I",
            "title": "方案與導入"
          }
        ],
        "fines": [
          {
            "coarse_id": "C",
            "id": "jgb/C/property-management-overview",
            "merge_of": [
              "tmp:canon:jgb/C/property-management-overview"
            ],
            "moved_from": [],
            "op": "keep",
            "reason": "潛在客戶問「房源管理能做什麼」的總覽入口；操作型問題（標籤怎麼建、怎麼匯入）各自成細目，不併入總覽。",
            "slug": "property-management-overview",
            "split_from": [],
            "target_user": [
              "prospect"
            ],
            "title": "房源管理模組做什麼（含自訂狀態標籤）"
          },
          {
            "coarse_id": "C",
            "id": "jgb/C/community-batch-create",
            "merge_of": [
              "tmp:canon:jgb/C/community-batch-create"
            ],
            "moved_from": [],
            "op": "keep",
            "reason": "潛在客戶問「物件多能不能一次建、能不能按社區歸戶」的總覽入口；業者的逐步操作與填表注意事項另成 community-create-edit 與 property-batch-import，層級不同以另見處理。",
            "slug": "community-batch-create",
            "split_from": [],
            "target_user": [
              "prospect"
            ],
            "title": "社區建立與批次新增物件"
          },
          {
            "coarse_id": "C",
            "id": "jgb/C/property-status-meaning",
            "merge_of": [
              "tmp:canon:jgb/C/property-status-meaning",
              "tmp:kb:3428",
              "tmp:kb:4154"
            ],
            "moved_from": [],
            "op": "merge",
            "reason": "「這個物件現在什麼狀態、租客看不看得到」是同一個問題；3428 的兩軸定義是既有細目的同命題補強，4154 為空內文入口只當講法吸收。",
            "slug": "property-status-meaning",
            "split_from": [],
            "target_user": [
              "prospect",
              "property_manager"
            ],
            "title": "物件狀態（未刊登／刊登中／洽談中／合約中）是什麼意思"
          },
          {
            "coarse_id": "C",
            "id": "jgb/C/rental-storefront-vr",
            "merge_of": [
              "tmp:canon:jgb/C/rental-storefront-vr"
            ],
            "moved_from": [],
            "op": "keep",
            "reason": "潛在客戶問「有沒有對外招租頁、能不能線上看屋」的總覽入口；業者問入口在哪、怎麼分享、VR 怎麼綁各是不同問題，另成細目。",
            "slug": "rental-storefront-vr",
            "split_from": [],
            "target_user": [
              "prospect"
            ],
            "title": "招租店舖與 VR 看屋"
          },
          {
            "coarse_id": "C",
            "id": "jgb/C/community-create-edit",
            "merge_of": [
              "tmp:kb:3468",
              "tmp:kb:3469"
            ],
            "moved_from": [],
            "op": "new",
            "reason": "業者問「社區怎麼建／改、物件怎麼掛到社區下、公共區域物件、社宅為何強制綁社區」為一組可獨立回答的操作問題，與批次匯入分開。",
            "slug": "community-create-edit",
            "split_from": [],
            "target_user": [
              "property_manager"
            ],
            "title": "社區怎麼建立、編輯，物件怎麼歸屬社區"
          },
          {
            "coarse_id": "C",
            "id": "jgb/C/property-batch-import",
            "merge_of": [
              "tmp:kb:3431",
              "tmp:kb:3357",
              "tmp:draft:1"
            ],
            "moved_from": [],
            "op": "new",
            "reason": "業者問「批次匯入怎麼做、表格怎麼填、為什麼上傳失敗、匯入後為何未刊登」落在同一路徑；三份來源分別是步驟、.xls 與貼上注意事項、欄位填法，合為一題。",
            "slug": "property-batch-import",
            "split_from": [],
            "target_user": [
              "property_manager"
            ],
            "title": "物件批次匯入：範本、表格填寫與上傳失敗"
          },
          {
            "coarse_id": "C",
            "id": "jgb/C/property-listing-conditions",
            "merge_of": [
              "tmp:kb:3429",
              "tmp:kb:4151"
            ],
            "moved_from": [],
            "op": "new",
            "reason": "「怎麼刊登」與「為什麼不能刊登」是同一問題的正反兩面（方案、額度、必填欄位）；4151 為空內文入口只當講法。",
            "slug": "property-listing-conditions",
            "split_from": [],
            "target_user": [
              "property_manager"
            ],
            "title": "物件要怎麼刊登上架、刊登需要什麼條件"
          },
          {
            "coarse_id": "C",
            "id": "jgb/C/property-unlisting-reasons",
            "merge_of": [
              "tmp:kb:3430",
              "tmp:kb:3506"
            ],
            "moved_from": [],
            "op": "new",
            "reason": "業者問「怎麼手動下架」與「物件為什麼突然全部下架」都以下架為起點；3506 根因在方案續約失敗，但提問落在物件狀態，留在本架並另見方案架。",
            "slug": "property-unlisting-reasons",
            "split_from": [],
            "target_user": [
              "property_manager"
            ],
            "title": "物件怎麼下架、為什麼被自動下架"
          },
          {
            "coarse_id": "C",
            "id": "jgb/C/property-edit-vs-publish",
            "merge_of": [
              "tmp:kb:4147"
            ],
            "moved_from": [],
            "op": "new",
            "reason": "「我改了物件怎麼沒生效／沒存到」是獨立於刊登條件的問題：答案是編輯≠刊登、要按儲存、改物件不影響既有合約。",
            "slug": "property-edit-vs-publish",
            "split_from": [],
            "target_user": [
              "property_manager"
            ],
            "title": "編輯物件與刊登物件差在哪、為什麼修改沒存到"
          },
          {
            "coarse_id": "C",
            "id": "jgb/C/property-add-blocked",
            "merge_of": [
              "tmp:kb:3505"
            ],
            "moved_from": [],
            "op": "new",
            "reason": "業者的提問以「新增物件按不了」為起點，本細目只做排查入口（額度滿→另見方案架、權限不足→另見團隊架），不在本架展開額度與角色機制。",
            "slug": "property-add-blocked",
            "split_from": [],
            "target_user": [
              "property_manager"
            ],
            "title": "為什麼不能新增物件"
          },
          {
            "coarse_id": "C",
            "id": "jgb/C/public-display-address",
            "merge_of": [
              "tmp:kb:4145",
              "tmp:kb:4152"
            ],
            "moved_from": [],
            "op": "new",
            "reason": "同一個誤解（以為設定沒生效）對應同一答案（只作用於對外廣告頁與地圖）；4152 為空內文入口只當講法。",
            "slug": "public-display-address",
            "split_from": [],
            "target_user": [
              "property_manager"
            ],
            "title": "對外顯示地址改了為什麼後台還是完整地址"
          },
          {
            "coarse_id": "C",
            "id": "jgb/C/storefront-entry-share",
            "merge_of": [
              "tmp:kb:4146"
            ],
            "moved_from": [],
            "op": "new",
            "reason": "業者的操作問題（入口、/p/ 網址、與帳號資訊連動、非刊登中不顯示）與潛在客戶的「有沒有招租頁」總覽是不同層級，另成細目。",
            "slug": "storefront-entry-share",
            "split_from": [],
            "target_user": [
              "property_manager"
            ],
            "title": "招租店舖入口在哪、怎麼分享、為什麼物件沒出現"
          },
          {
            "coarse_id": "C",
            "id": "jgb/C/community-public-page",
            "merge_of": [
              "tmp:kb:3470"
            ],
            "moved_from": [],
            "op": "new",
            "reason": "「社區公開頁」與「招租店舖」是兩個不同的對外頁面，使用者會分開問；本細目只答社區頁，店舖另見。",
            "slug": "community-public-page",
            "split_from": [],
            "target_user": [
              "property_manager"
            ],
            "title": "社區公開頁面是什麼、能拿來做什麼"
          },
          {
            "coarse_id": "C",
            "id": "jgb/C/property-vr-tour",
            "merge_of": [
              "tmp:kb:3433"
            ],
            "moved_from": [],
            "op": "new",
            "reason": "業者問「VR 怎麼設定、拍攝／費用找誰」是操作與廠商分工問題，與招租店舖總覽層級不同，獨立成細目。",
            "slug": "property-vr-tour",
            "split_from": [],
            "target_user": [
              "property_manager"
            ],
            "title": "物件 VR 虛擬導覽怎麼綁、費用與拍攝找誰"
          },
          {
            "coarse_id": "C",
            "id": "jgb/C/property-custom-tags",
            "merge_of": [
              "tmp:kb:3434"
            ],
            "moved_from": [],
            "op": "new",
            "reason": "「標籤在哪建、怎麼掛到物件、能不能篩選、租客看不看得到」是一組操作問題，與房源管理總覽分層。",
            "slug": "property-custom-tags",
            "split_from": [],
            "target_user": [
              "property_manager"
            ],
            "title": "物件自訂標籤怎麼建、怎麼用來篩選"
          },
          {
            "coarse_id": "C",
            "id": "jgb/C/property-advanced-search",
            "merge_of": [
              "tmp:draft:2"
            ],
            "moved_from": [],
            "op": "new",
            "reason": "「物件太多怎麼篩」是獨立的操作問題（空間類型、社區大樓、租金範圍、坪數），與標籤篩選是不同機制，各自一題。",
            "slug": "property-advanced-search",
            "split_from": [],
            "target_user": [
              "property_manager"
            ],
            "title": "物件列表進階搜尋怎麼用"
          },
          {
            "coarse_id": "C",
            "id": "jgb/C/occupancy-rate-calculation",
            "merge_of": [
              "tmp:kb:4648"